title,description,company
Software Engineer,"Looking for a software engineer with experience in Python, machine learning, and cloud platforms. Familiarity with agile methodologies and CI/CD is required.",Hooli
Project Manager,"We are seeking a project manager with expertise in agile frameworks, team leadership, and project planning. Experience in risk management and cross-team collaboration is a plus.",Hooli
Data Scientist,"Hiring a data scientist with proficiency in Python, SQL, R, and deep learning. Candidates should have experience with predictive modeling, data visualization, and statistical analysis.",Pied Piper
Full Stack Developer,"Seeking a full-stack developer with strong knowledge in React, Node.js, and SQL. Must be able to build scalable applications and work in a fast-paced environment.",Pied Piper
Cybersecurity Analyst,"Looking for a cybersecurity analyst experienced in network security, threat detection, and incident response. Strong understanding of security protocols and vulnerability assessments is required.",Raviga
